{
  "captf_contract": "v1alpha1",
  "captf_cluster": {
    "name": "prod",
    "namespace": "team-a"
  },
  "captf_object": {
    "kind": "TerraformMachinePool",
    "name": "prod-mp-0",
    "namespace": "team-a"
  },
  "captf_tags": {
    "captf.io/cluster": "prod",
    "captf.io/kind": "TerraformMachinePool",
    "captf.io/managed-by": "captf",
    "captf.io/name": "prod-mp-0",
    "captf.io/namespace": "team-a",
    "captf.io/template": ""
  },
  "captf_cluster_outputs": {
    "network_id": "net-1",
    "note": "a\u003cb \u0026 c\u003ed"
  },
  "machinepool_name": "prod-mp-0",
  "replicas": 3,
  "bootstrap_data": "I2Nsb3VkLWNvbmZpZwpydW5jbWQ6CiAgLSBlY2hvIDxyZWFkeT4gJiBkb25lCg==",
  "bootstrap_format": "cloud-config",
  "failure_domains": [],
  "cluster_failure_domains": [
    "zone-a",
    "zone-b"
  ],
  "kubernetes_version": "v1.36.2",
  "node_labels": {
    "pool": "prod-mp-0"
  },
  "autoscaling": {
    "enabled": false,
    "min": 0,
    "max": 0
  }
}
